513402	宾夕法尼亚大学University of Pennsylvania简称宾大、UPenn、Penn创办人本杰明·富兰克林创办时间1740年类别私立大学类型综合研究型大学属性常春藤盟校成员,贵格大学联盟(Quakers Consortium)成员,美国大学协会创始成员现任领导校长：艾米·古特曼院系设置商学院、法学院、医学院、传媒学院、艺术与科学学院、工程与应用科学学院等校训Leges Sine Moribus Vanae（法无德不立）地址Philadelphia, PA 19104主要奖项28位诺贝尔奖、1位图灵奖、8位美国国家科学奖章得主,115位美国国家学院院士、79位美国艺术与科学学院院士、30位美国哲学学会院士等 ,2位美国总统、9位《独立宣言》签字者、11位美国宪法签字者知名校友唐纳德·特朗普、沃伦·巴菲特、埃隆·马斯克、乔治·克莱默等吉祥物贵格会教徒（Quaker）学生人数24876学校面积279英亩（核心校区）世界排名17（2019软科世界大学学术排名）世界排名11（2020泰晤士高等教育世界大学排名）世界排名15（2020QS世界大学排名）世界排名16（2020USNews世界大学排名）学校官网http://www.upenn.edu/。宾夕法尼亚大学（University of Pennsylvania ），简称宾大（UPenn），位于宾夕法尼亚州最大城市费城，是一所全球顶尖的私立研究型大学，著名的八所常春藤盟校之一，北美顶尖大学学术联盟美国大学协会14所创始成员之一。宾大由本杰明·富兰学校历史创立宾夕法尼亚大学由美国著名科学家和政治家、开国元勋、《独立宣言》起草人之一，避雷针、富兰克林炉及远近两用眼镜等的发明者本杰明·富兰克林创办于1740年，建校时间早于美国建国（1776年），《独立宣言》的9位签字者和美国宪法的11位签字者与该校有关	ins
20548828	公司类型有限责任公司(台港澳与境内合资)登记机关珠海市工商行政管理局成立时间1993年08月08日发照时间2016年06月17日。珠海华粤传动科技有限公司于1993年08月08日在珠海市工商行政管理局登记成立。法定代表人倪川，公司经营范围包括生产和销售自产的汽车离合器、制动器、汽车灯具等。企业信息	org
22782371	周明晶国籍中国运动项目帆船所属运动队海南队。周明晶，中国帆船运动员。2018年6月11日，2018年全国青年帆船锦标赛在大连将军石中国帆船帆板训练基地收帆。海南省队周明莹、周明晶获得女子470级场地赛冠军。2019年5月3日，2019年全国青年帆船锦标赛在武汉东湖收官。来自青海的周明晶/周明莹在女子470级场地赛、长距离两	human
18644392	书名大国外交：从第一次世界大战至今作者[美]诺曼·里奇  译者时殷弘 ISBN978-7-300-17717-5定价78.00出版社中国人民大学出版社出版时间2015-08-31装帧平装开本16。在本书中，我力图描述那些我所认为的“从过去承继下来的条件”中最重要者，只要它们是与国际事务相关的。 我没有任何大胆的新解释要提供，也不持任何历史目的，抑或要对马克思主义理论或弗洛伊德学说作什么新颖的倒转。然而，从头到尾，我的压倒性关切集中在“维持和平”这一内容简介本书主要介绍第一次世界大战爆发至今的这100年间，大国关系与世界格局的深刻演变，阐释大国的外交政策，聚焦影响世界历史进程的重大事件，如两次世界大战的起源、过程，中国的抗日战争与内战，朝鲜战争，苏联的崛起与美苏争霸，苏联解体与东欧剧变，海湾战争， “	pub
17348897	许晋文出生地山西省中阳县出生日期1971年11月毕业院校山西大学。许晋文，男，汉族，1971年11月生，山西省中阳县人，大学本科学历，经济学学士，1994年7月参加工作，1998年12月加入中国共产党。现任吕梁市委党校常务副校长。人物履历1990.09——1994.07 山西大学学习1994.07——1997.09 吕梁地委党校教师1997.09——2002.10 吕梁地委组织部干部科科员2002.10——2005.04 吕梁地委组织部组织史征编办副主任2005.04——2007.	human
3026941	丽台FX3450芯片厂商 nVIDIA核心代号 NV42GL显存频率 1000MHz。丽台FX3450，核心代号是NV42GL。丽台 FX3450 显卡核心显卡芯片 Quadro FX3450丽台 FX3450 显卡频率核心频率 425MHz丽台 FX3450 显存规格显存类型 DDRIII显存容量(MB) 256显存位宽 256bit最高分辨率 2048*1536丽台 FX345	life
8701940	2013款瑞风S5 1.8T 手动尊享版级别SUV长×宽×高(mm)4475*1840*1680最高车速190。2013款瑞风S5 1.8T 手动尊享版是长×宽×高为4475*1840*1680(mm)的SUV汽车。基本参数厂商江淮汽车级别SUV发动机1.8T 163马力 L4变速箱6挡手动长×宽×高(mm)4475*1840*1680车身结构5门5座SUV最高车速(km/h)190官方0-100km/h加速(s)-实测0-100km/h加速(s)-实测100-0km	life
19011335	软件名称井字3D Tic Tac Toe 3D软件平台IOS软件大小394.36KB。《井字3D Tic Tac Toe 3D》是一款IOS平台的应用。应用介绍经典的 Tic Tac Toe游戏 带给 你的手 的手掌 比以往任何时候都 更 令人兴奋的 是 卓越 的 方式 ！ 经典游戏 终于可以 在你的iPhone 或iPod ， 但 在 一个全新的层面 ：3D。  井字 3D 的组合 增加了更多 的 热量	sci
2603997	中文学名黑头穗鹛河口亚种拉丁学名Stachyris nigriceps yunnanensis界动物界门脊索动物门纲鸟纲目雀形目科鹟科亚科画眉亚科属穗鹛属种黑头穗鹛亚种黑头穗鹛河口亚种定名人及年代La Touche,1921。黑头穗鹛河口亚种（学名：Stachyris nigriceps yunnanensis）。分布于缅甸、泰国、老挝、越南以及中国大陆的云南、广西等地。该物种的模式产地在云南河口。外形特征体型略小（13.5厘米）的橄榄褐色穗鹛。顶冠及颈背近黑而带白色纵纹，黑色的长眉纹下有一白线，白色的下颊纹其上为灰色，颏及喉深灰，眼圈白，下体橄榄皮黄色。虹膜－浅褐；嘴－偏黑；脚－暗黄。分布范围国内分布：云南（元阳、屏边、河口）、广西（龙津）国外分布	nature
21464108	公司类型有限责任公司登记机关扬州市广陵区市场监督管理局成立时间2013年06月06日发照时间2016年05月16日。江苏银迪通商业信息服务有限公司于2013年06月06日在扬州市广陵区市场监督管理局登记成立。法定代表人王俊，公司经营范围包括商务信息服务，经济信息咨询，会议服务，软件开发等。企业信息	org
8199264	公司名称南京亿高医疗设备有限公司总部地点南京成立时间2000年经营范围医疗设备。南京亿高是2000年成立的，集科研开发、生产、销售和服务为一体的股份制高科技企业。公司简介亿高公司是由南京亿高微波系统工程有限公司和南京亿高医疗设备有限公司组成，亿高微波系统工程有限公司侧重于医疗设备的科研开发和生产领域，亿高医疗设备有限公司则侧重于医疗产品的销售和服务领域。南京是全国公认的医用微波产品发源地，而亿高公司则是目前南京最大	org
3430097	三级节水管理网络纽带区域和行业管理目标完善节水的循环管理网络包括社区节水网络。以区域和行业管理为纽带，完善节水的循环管理网络。一是社区节水网络：即区节水办——街镇——居委会和村委会三级节水管理网络；二是重点区域节水网络：即区节水办——海洋科技园区、大港开发区等——进驻企业三级节水管理网络；三是行业节水网络：即区节水办——各委办局(如教育局、卫生局)——所辖单位(如学校和医院)三级	other
8911976	咖啡乳酒主要产于咖啡生产国, 它的原料是咖啡豆. 先焙烘粉碎咖啡豆, 再进行浸制和蒸馏，然后将不同的酒液进行勾兑，加糖处理，澄清过滤而成。酒度26o左右。咖啡乳酒属普通利口酒。较出名的有：Kahlúa(高拉，墨西哥) ，Tia Maria(蒂亚·玛丽亚) 	other
16353447	书名健康9元书系列出版社金盾出版社语种简体中文ISBN9787508276427作者金盾出版社 王陇德出版日期2012年6月1日开本16品牌金盾出版社。《健康9元书系列(套装共50册)》由卫生部原副部长、中华预防医学会会长、卫生部“健康中国2020战略研究组”首席专家、卫生部疾病预防控制专家委员会主任委员、中国工程院院士王陇德任总主编。该系列图书主要作者有胡大一、洪昭光、瞿佳、向红丁、郭冀珍等全国知名医学内容简介《健康9元书系列(套装共50册)》特点： 　　权威——中国工程院院士、卫生部原副部长、中华预防医学会会长王陇德任总主编，全国知名一流专家编写，有胡大一、洪昭光、向红丁、瞿佳、郭冀珍教授等。 　　种类齐全——涉及防病治病、养生保健、饮食营养等。 　　	pub
7078837	热熔标线涂料用处标志道路标线作用安全标记用法涂敷在道路上。热熔标线涂料是涂敷在道路上，用于标志道路标线的一种涂料。道路标线是一种安全标记，在公路交通中更是一种无声的“语言”。前言道路标线涂料是涂敷在道路上，用于标志道路标线的涂料。它是一种安全标记，是在公路交通中的一种“语言”。简介我国使用的道路标线涂料有热熔型、水性和常温溶剂型三类。交通安全管理部门利用道路标线达到加强交通安全管理、减少事故和美化城市道路的目的，而醒目的道路标	other
22439663	书名一次管一生的教育作者齐大辉ISBN9787545908879出版社鹭江出版社。《一次管一生的教育》是一部由齐大辉所著书籍，鹭江出版社出版发行。出版信息作者:齐大辉  　　出版社: 海峡出版发行集团/鹭江出版社　　出版年: 2015-4　　页数: 256　　定价: 36　　装帧: 平装　　ISBN: 9787545908879内容简介《一次管一生的教育》是齐大辉教授历时十多年从事中国家庭科学研究的	pub
14660934	童话纷飞作者恩劈西小说进度暂停连载网站晋江文学城。《童话纷飞》是连载于晋江文学城的小说，作者是恩劈西。小说类型爱情内容简介随便在这里发一下,哈哈。=灵感来源于暗黑破坏神...突然很想再多写几个...也许这是一个没有特定主角的故事。也许,这是一个没有固定的顺序的故事。也许,这个故事将脱离开原先的设定……	webfic
20311456	歌曲Always, In All Ways语言英语发行日期2006-05-08歌手Kenny Loggins所属专辑More Songs From Pooh Corner。歌词Always, in all waysYou&apos;ll be in my mindFor always, in all waysWords have been so hard to findI still remember you as a ch	play
21870023	审结日期2017年2月10日审理法院安徽省安庆市迎江区人民法院文件类型裁定书审理程序一审。祖洁诉潘秀文等机动车交通事故责任纠纷案是2017年2月10日在安徽省安庆市迎江区人民法院审理的案件。案由民事、侵权责任纠纷、机动车交通事故责任纠纷权责关键词民商事、诉讼关键词、临时性救济和保障程序、财产保全、执行、查封、扣押、冻结案例原文安徽省安庆市迎江区人民法院民事裁定书申请人祖洁。被申请人潘秀文。被申请人方星。被申请人方友建。申请人祖洁与被申请人潘秀	soc
20349651	厦门伟长兴贸易有限公司是泓涵集团的子公司之一，位于厦门经济特区的金融核心商圈——厦门航空商务广场。公司紧邻高崎国际机场、五缘湾湿地公园以及环岛路，环境优美，交通便利。厦门伟长兴贸易有限公司以进出口贸易为主要业务，同时自主研发生产食品、养生保健产品等。其中，	org
2109922	书名打与谈的艺术作者马云鹏ISBN9787535833389页数186出版社湖南少儿出版社出版时间2007-4-1装帧平装纸张胶版纸。《打与谈的艺术》是2007年04月由湖南少儿出版社出版的图书。该书主要讲述了在平津战役前夕，毛主席在打与谈之间权衡如何解放华北的故事。内容简介1948年的冬天早早就到来了。此时，在太行山下、滹沱河畔的小山村——西柏坡，有一个人却安适地仰卧在干草堆上，沐浴着冬日暖阳，这个人就是毛主席。此刻，这位决定着中华民族命运和战争命运的伟人在思考些什么呢？这时，辽沈战役已经结束，淮海战役也在顺利进行着	pub
12671497	对氟苯乙酰氯:4-Fluorophenylacetyl chloride别称4-氟苯乙酰氯化学式C8H6ClFO分子量172.584CAS登录号459-04-1。中文名称:对氟苯乙酰氯  英文名称:4-Fluorophenylacetyl chloride基本信息中文名称:对氟苯乙酰氯英文名称:4-Fluorophenylacetyl chloride中文别名:4-氟苯乙酰氯英文别名:-CAS号:459-04-1分子式:C8H6ClFO分子量:172.584安全信息风险术语R34:Causes burns.	nature
23910443	将相和之姻缘乱作者鬼斗类型古代言情连载状态已完结。将相和之姻缘乱是一部古代言情类型网络小说，作者是鬼斗。内容简介楚仪是楚家的外室女，虽然楚家只是个小门小户的人家，她却也在其中受尽欺凌。她的嫡母，恨不能毁她容，将她嫁个世上最破烂的人家；她的长姐，盼望着要她的性命而她那唯一的亲人，亲生的哥哥，又想要将她卖给他人作妾。这是怎样的世道，亲情如此不堪一击。而她，终究碰	webfic
16661812	Podstawski Tomás国籍葡萄牙出生地波尔图出生日期1995年1月30日身高1.81米运动项目足球。Podstawski Tomás,葡萄牙籍足球运动员。场上位置中场职业生涯时间　　球队　　2012 - 2012波尔图2013 - 2013PortugalU-192014 - 2014PortugalU-19荣誉时间　　球队　　联赛　　2012波尔图葡超	human
22457720	原来爱情他来过作者蝶彩类型现代言情连载状态完结连载平台掌读看书最新章节第383章 我跟你没完（大结局）。《原来爱情他来过》是一部连载于掌读看书的现代言情类小说。讲述：遇到李沫白那年，我二十五岁。作品简介遇到李沫白那年，我二十五岁。他是端坐贵宾席的贵客，我是狼狈地躲进化妆间的新娘。婆婆恶意驱逐，丈夫有心背叛，我成了世上最没有尊严的女人。李沫白说，做我的女人，我让你拥有一切！沦陷在他的深情里，我甘愿做他的情人！只是我终不信，我们之间是否真的有爱情？章	webfic
1563641	书名全国统一建筑工程基础定额应用手册ISBN9787801592224页数2132页出版社中国建材工业出版社出版时间2002年2月1日装帧平装开本16版次第1版 。《全国统一建筑工程基础定额应用手册》是2002年中国建材工业出版社出版的图书。本书按照《基础定额》的章节次序，针对定额中（编制）说明及工程量计算规则，定额所列分步分项工程名称的具体意义，定额项目所组成人工、材料、机械的具体解释以及实际操作过程中经常遇到的特内容简介我们编写《全国统一建筑工程基础定额应用手册(套装全4册)》主要有以下目的：一、求“实际操作”，即一切从预决算工作者实际操作的需要出发，一切为预算员着想。在编写过程中，我们一直设身处地把自己看成实际操作者，实际操作者需要什么，我们就编什么。总结出的释	pub
24035031	都市万兽之王作者猴四李类型玄幻连载状态已完结。都市万兽之王是一部玄幻类型网络小说，作者是猴四李。内容简介上古仙人大战......    自此仙凡隔绝，人界仙气枯竭，陷入了末法时代。    都市少年偶得绝世修炼秘籍，踏上了一条不一样的修炼之路。    一路上，收异兽，泡美女，挫强敌，斩荆棘......        终成，万兽之王！    新书我以手机	webfic
10937039	寂寂竟何待，朝朝空自归。欲寻芳草去，惜与故人违。当路谁相假，知音世所稀。只应守寂寞，还掩故园扉。【作者】：孟浩然    【朝代】：唐    【体裁】：五言律诗【格律】：○平声  ●仄声  ⊙可平可仄  △平韵   ▲仄韵寂寂竟何待，朝朝空自归。●○●○●，	cul
14645876	黑道之我最流氓作者书生疯流子小说进度连载连载网站纵横中文网。《黑道之我最流氓》是在纵横中文网连载的小说，作者是书生疯流子。小说类型都市娱乐内容简介何为黑?何为白?正邪间,又有几人能分得清界限?如果上天给我一个复仇的机会,就算是黑色的,又能怎样...他们,是人们眼中的社会流氓、人渣。 但是,他们为了兄弟、亲人。拿起手中的砍刀和拳头,会毫不犹豫的指向敌人。就算是拼命,也在所不惜。	webfic
4469619	陈美堂国籍中国出生日期1872逝世日期1936。陈美堂（），今潮南陇田镇浩溪人。少年聪颖有大志，遵父训致力学医，虽有心得，但自感医学未精，不敢贸然行医。父亲去世后，于清朝末年赴暹罗（今泰国）经商。稍有积蓄，在曼谷创办大安堂药行，后与陈泽猷等合办耀华力药行。基本信息美堂身在海外，心系故园，常抨挞清廷腐败，国土遭列强瓜分，暗无天日。光绪三十一年（1905）在暹罗参加了同盟会，积极行动，支持国内之辛亥革命。民国四年（1915）任国民党暹罗支部长，与萧佛成合办新民学校。民国八年，护法军舰南下广州，美堂往广州谒见孙中	human
13184386	莲无忧作者Lucky阿韵小说进度连载连载网站起点中文网。《莲无忧》是Lucky阿韵写的网络类型小说，连载于起点中文网。小说类型架空历史内容简介不知君心似我心,不如无事莫多情。 终有一日问君心,君却道我本无心。 无心插柳柳成荫,应笑并非无忧清。 无情亦无忧,从此,你便叫做莲无忧吧。 前世被爱人杀了父亲,复仇杀了爱人结果自己也被杀,转世投胎没想到又一次亲人被杀害,只是这次连杀	webfic
14808740	妖刀传奇作者小李飞铲小说进度连载连载网站纵横中文网。《妖刀传奇》是连载于纵横中文网的小说，作者是小李飞铲。小说类型新派武侠内容简介一把看似普通的刀却隐藏着惊天秘密;一个善良敦厚的人却掀起了腥风血雨;一次义无反顾的选择注定了他多舛的命运;一段可歌可泣的复雠经历成就了他的铁血传奇。刀,为何竟会哭泣?人,为何总是伤心?那倾国倾城的最后一刀将是何等艳丽?一刀倾城,一个	webfic
21307781	所属专辑乐拍乐高 2音乐时长1分37秒。《错爱》是麒麟的音乐作品，收录在《乐拍乐高 2》专辑中。歌词错爱  - 麒麟　　词：樊志毅Micheal.C 曲：樊志毅Micheal.C　　不去想不会忘忘掉忧伤　　下一秒让现实把你遗忘　　那时候你对我讲　　让我们一起成长　　到现在却又是离别感伤　　一句话是否是最终方向　　没有人会了解什么是原谅　　那时候你对我	play
14853857	婉佩如林作者婉佩如小说进度连载连载网站天涯读书。《婉佩如林》连载于天涯读书，作者是婉佩如。小说类型言情小说内容简介她,南方柳军司令千金,二八芳华,既聪慧可人,又不乏巾帼豪情,才气逼人。他,北地锦军大帅之子,英姿飒爽,权倾一方,却在南方意外遭袭。她去国三年,回程途中,飞马相救。数月后,他意外在北地大帅府偶遇她,却相见不相识。自遇袭后,他便陷入了重	webfic
10851618	乌瑟多姆是波罗的海南岸岛屿，与沃林岛同处奥得河口外。乌瑟多姆岛波兰语称“乌兹纳姆”。南侧形成什切青湾（奥得湾），北侧亦出现敞开式的波美拉尼亚湾（波莫瑞湾）。向海一面岸线平直，向大陆一面曲折。面积442平方公里。原属德国。第二次世界大战德国战败，1945年将该岛东端（沿希维纳海峡西岸）的长条状地带划归波兰，其	other
6071815	书名民间收藏与鉴赏：古砚收藏与鉴赏页数147出版社上海大学出版社出版时间第1版 (2008年5月1日)装帧平装开本16。《民间收藏与鉴赏古砚收藏与鉴赏》是2008年上海大学出版社出版的图书，作者是郭传火。图书信息正文语种: 简体中文ISBN: 7811182416, 9787811182415条形码: 9787811182415尺寸: 20.8 x 14 x 1.4 cm重量: 322 g作者简介郭传火，中国作家协会会员，生于1963年。著有《中国保姆》、	pub
13476463	宣武村委会国土面积 32.50平方公里海拔1580.00米耕地3170.70亩。宣武村委会，属于半山区。距离村委会0.00公里,距离镇20.00公里， 国土面积32.50平方公里，海拔1580.00米，年平均气温18.10℃，年降水量920.00毫米，适宜种植烤烟、水稻等农作物。有耕地3170.70亩，其中人均耕地0.88亩；有林地1村情概况宣武村委会，属于半山区。距离村委会0.00公里,距离镇20.00公里， 国土面积32.50平方公里，海拔1580.00米，年平均气温18.10℃，年降水量920.00毫米，适宜种植烤烟、水稻等农作物。有耕地3170.70亩，其中人均耕地0.88亩；	ins
7927976	威尔逊·扬科国籍葡萄牙 　出生日期1994-07-23　职业足球运动员。威尔逊·扬科是一名足球运动员，效力于里斯本竞技预备队。个人资料姓名：威尔逊·扬科场上位置:后卫身高：173厘米体重：62公斤惯用脚：右脚出生地：未知(葡萄牙)代表国家队：出场0次，进0球欧洲三大杯：出场0次，进0球欧洲冠军联赛：出场0次，进0球职业生涯赛季俱乐部号码出场进球国家联赛等级排名2012/2013里	human
18573485	全国人大常委会办公厅关于对矿山企业审批和发证程序问题的答复颁布单位全国人大常委会办公厅颁布时间1993.05.24实施时间1993.05.24。《全国人大常委会办公厅关于对矿山企业审批和发证程序问题的答复》在1993.05.24由全国人大常委会办公厅颁布。地质矿产部：你部关于请求对矿产资源法第十三条有关矿山企业审批和发证程序进行法律解释的函收悉。经研究，提出以下答复意见：矿产资源法第三条规定，“开采矿产资源，必须依法申请取得采矿权。”第十三条规定，“开办国营矿山企业，分别由国务院、国务院有关主管部门和省、自	soc
3026214	胡名义国籍中国出生日期1951年11月信仰中共党员。胡名义，男，1951年11月生，中共党员，在职大学学历，现任省国家保密局副局长、省委保密委员会办公室副主任，拟任省委办公厅副巡视员；	human
12489190	作者郑宝根ISBN9787550800816页数191定价1080.00元出版时间2011-4。图书信息郑宝根竹雕艺术，ISBN：9787550800816，作者：张球 编著。	pub
6415285	台与とよ、toyo别名臺與国籍日本民族日本倭人出生日期235年职业邪马台国女王出自三国志·魏志倭人传。台与（235年？－？），《三国志·魏志倭人传》中继承邪马台国女王卑弥呼之位的女性。卑弥呼死后有人更立男王国中不服， 死了千人于是复立台与为女王。异字的记载台与相关的记载，因繁体字台与壹相似，便有出现“台与”和“壹与”两种写法。“壹与”：出现于魏志倭人传（=三国志魏志东夷传倭人之条，3世纪晋代陈寿编纂）“台与”：出现于梁书诸夷传（唐代姚思廉编纂）及北史东夷传（唐代李延寿编纂）虽然《三国志》的成书时间	human
8057402	书名建筑业农民工入场安全知识必读作者建设部安全生产管理委员会办公室、建设部工程质量安全监督与行业发展司ISBN10位[7112096944]13位[9787112096947]定价￥2.00元出版社中国建筑工业出版社出版时间2007-1-1。《建筑业农民工入场安全知识必读》是2007年中国建筑工业出版社出版的图书，作者是建设部安全生产管理委员会办公室、建设部工程质量安全监督与行业发展司。内容简介本书为建筑业农民工入场安全知识普及读本，共分四部分：第一部分介绍农民工的权利义务和进入现场必须掌握的安全基本知识；第二部分重点介绍施工现场各工序中存在的主要危险；第三部分为相关法律法规摘录；第四部分为施工现场常见的警示标志牌和应急电话。本书内容实用	pub
10800669	范烧烧别名范敏迪出生地成都代表作品《姜子牙的恋爱课》。这是一位我很喜欢的作家：作者自己的简介：范烧烧，本名范敏迪，女，成都人。曾经玩是我生命中最重要的事，在东南亚玩耍了几年，终于厌倦，后回到成都，从报社记者做到责编，工作成绩还行。可骨子里始终自由散漫不喜约束，终于转行，成为写手界的新人。为人甚懒，产量低得可笑这是一位我很喜欢的作家：作者自己的简介：范烧烧，本名范敏迪，女，成都人。曾经玩是我生命中最重要的事，在东南亚玩耍了几年，终于厌倦，后回到成都，从报社记者做到责编，工作成绩还行。可骨子里始终自由散漫不喜约束，终于转行，成为写手界的新人。为人甚懒，产量低得可笑	human
